Dodatek,Osnova
Gloomhaven: Forgotten Circles,Gloomhaven
Gloomhaven: Solo Scenarios,Gloomhaven
Gloomhaven: The End of the World (Promo Scenario),Gloomhaven
Through the Ages: New Leaders and Wonders,Through the Ages: A New Story of Civilization
Terraforming Mars: Gathering of Friends Promo Card,Terraforming Mars
Terraforming Mars: Turmoil,Terraforming Mars
Terraforming Mars: Atmo Collectors Promo Card,Terraforming Mars
Terraforming Mars: BGG User-Created Corporation Pack,Terraforming Mars
Terraforming Mars: Colonies,Terraforming Mars
Terraforming Mars: Jovian Lanterns Promo Card,Terraforming Mars
Terraforming Mars: Lunar Exports Promo Card,Terraforming Mars
Terraforming Mars: Prelude,Terraforming Mars
Terraforming Mars: Hellas & Elysium,Terraforming Mars
Terraforming Mars: Penguins Promo Card,Terraforming Mars
Twilight Struggle: Turn Zero and Promo Packs,Twilight Struggle
Twilight Struggle: Regime of the Colonels Promo Card,Twilight Struggle
Twilight Struggle: Promo Deck,Twilight Struggle
Twilight Struggle: Turn Zero,Twilight Struggle
"Twilight Struggle: ""Pakt Bagdadzki"" and ""Stan Wojenny"" Promo Cards",Twilight Struggle
"Twilight Struggle: ""Referendum NATO"" Promo Card",Twilight Struggle
"Twilight Struggle: ""Anni di Piombo"" Promo Card",Twilight Struggle
"Twilight Struggle: ""Gladio"" Promo Card",Twilight Struggle
"Twilight Struggle: ""Финляндизация"" Promo Card",Twilight Struggle
Star Wars: Rebellion – Rise of the Empire,Star Wars: Rebellion
Scythe: Modular Board,Scythe
Scythe: Bonus Promo Pack – 6 Promo Encounter Cards numbers 37-42,Scythe
Scythe: Encounters,Scythe
Scythe: The Rise of Fenris,Scythe
Scythe: Promo Pack #11 – Encounter Card 39,Scythe
Scythe: Promo Pack #12 – Encounter Card 40,Scythe
Scythe: Promo Pack #13 – Encounter Card 41,Scythe
Scythe: Promo Pack #14 – Encounter Card 42,Scythe
Scythe: The Wind Gambit,Scythe
Scythe: Invaders from Afar,Scythe
Brettspiel Adventskalender 2018,Great Western Trail
Great Western Trail: At the Poker Table,Great Western Trail
Great Western Trail: Rails to the North,Great Western Trail
Deutscher Spielepreis 2017 Goodie Box,Great Western Trail
Great Western Trail: Promo Station Master Tiles,Great Western Trail
Great Western Trail: The Eleventh Building Tile,Great Western Trail
Terra Mystica: Merchants of the Seas,Terra Mystica
Terra Mystica: Erweiterungsbogen,Terra Mystica
Terra Mystica: Fire & Ice,Terra Mystica
Terra Mystica: 4 Town Tiles,Terra Mystica
Terra Mystica: Bonus Card Shipping Value,Terra Mystica
War of the Ring: Warriors of Middle-earth,War of the Ring (Second Edition)
War of the Ring: Warriors of Middle-earth – Tidings Not Burdens Mini-Expansion,War of the Ring (Second Edition)
War of the Ring: Lords of Middle-earth,War of the Ring (Second Edition)
War of the Ring: Lords of Middle-earth – Treebeard Mini-Expansion,War of the Ring (Second Edition)
War of the Ring: Scenario – The Breaking of the Fellowship,War of the Ring (Second Edition)
Brettspiel Adventskalender 2018,The Castles of Burgundy
The Castles of Burgundy: 10th Expansion – Solo,The Castles of Burgundy
Brettspiel Adventskalender 2017,The Castles of Burgundy
The Castles of Burgundy: 8th Expansion – Trade Routes,The Castles of Burgundy
The Castles of Burgundy: 9th Expansion – The Team Game,The Castles of Burgundy
The Castles of Burgundy: 7th Expansion – German Board Game Championship Board 2016,The Castles of Burgundy
Brettspiel Adventskalender 2015,The Castles of Burgundy
The Castles of Burgundy: 6th Expansion – The Cloisters,The Castles of Burgundy
The Castles of Burgundy: 5th Expansion – Pleasure Garden,The Castles of Burgundy
Stadt Land Spielt Limitierter Sonderdruck Tag des Gesellschaftsspiels,The Castles of Burgundy
Spirit Island: Jagged Earth,Spirit Island
Spirit Island: Promo Pack 2,Spirit Island
Spirit Island: Unter der Insel schlummernde Schlange Promo,Spirit Island
Spirit Island: Branch & Claw,Spirit Island
Spirit Island: Champions of the Dahan Token Pack,Spirit Island
Spirit Island: Expansion Playmat,Spirit Island
Spirit Island: Promo Pack 1,Spirit Island
Leaders (fan expansion to  7 Wonders Duel),7 Wonders Duel
7 Wonders Duel: Pantheon,7 Wonders Duel
7 Wonders Duel: Statue of Liberty,7 Wonders Duel
7 Wonders Duel: The Messe Essen Promo Card,7 Wonders Duel
The 7th Continent: Comfort Creatures,The 7th Continent
The 7th Continent: The Flying Roots,The 7th Continent
"The 7th Continent: What Goes Up, Must Come Down",The 7th Continent
The 7th Continent: BGG Promo Cards,The 7th Continent
The 7th Continent: Facing the Elements,The 7th Continent
The 7th Continent: Fear the Devourers,The 7th Continent
The 7th Continent: Path of Repentance,The 7th Continent
The 7th Continent: Swamp of Madness,The 7th Continent
The 7th Continent: The Forbidden Sanctuary,The 7th Continent
The 7th Continent: The Icy Maze,The 7th Continent
Concordia: Venus (expansion),Concordia
Concordia: Aegyptus / Creta,Concordia
Concordia: 8 Forum Cards mini-expansion,Concordia
Concordia: Gallia / Corsica,Concordia
Concordia: Salsa,Concordia
Concordia: Britannia / Germania,Concordia
Viticulture: Visit from the Rhine Valley,Viticulture Essential Edition
Tuscany Essential Edition,Viticulture Essential Edition
Viticulture: Moor Visitors Expansion,Viticulture Essential Edition
Viticulture: Arboriculture Expansion,Viticulture Essential Edition
Viticulture: Kickstarter Promotional Cards,Viticulture Essential Edition
Puerto Rico: Expansions 1&2 – The New Buildings & The Nobles,Puerto Rico
Puerto Rico: Expansion II – The Nobles,Puerto Rico
Treasure Chest,Puerto Rico
Haiti (fan expansion for Puerto Rico),Puerto Rico
Puerto Rico: Expansion I – New Buildings,Puerto Rico
Arkham Horror: The Card Game – Before the Black Throne: Mythos Pack,Arkham Horror: The Card Game
Arkham Horror: The Card Game – For the Greater Good: Mythos Pack,Arkham Horror: The Card Game
Arkham Horror: The Card Game – In The Clutches of Chaos: Mythos Pack,Arkham Horror: The Card Game
Arkham Horror: The Card Game – Return to the Path to Carcosa,Arkham Horror: The Card Game
Arkham Horror: The Card Game – The Blob That Ate Everything: Scenario Pack,Arkham Horror: The Card Game
Arkham Horror: The Card Game – The Circle Undone: Expansion,Arkham Horror: The Card Game
Arkham Horror: The Card Game – The Secret Name: Mythos Pack,Arkham Horror: The Card Game
Arkham Horror: The Card Game – The Wages of Sin: Mythos Pack,Arkham Horror: The Card Game
Arkham Horror: The Card Game – Union and Disillusion: Mythos Pack,Arkham Horror: The Card Game
Arkham Horror: The Card Game – Beta Cards from Arkham Night 2018,Arkham Horror: The Card Game
Brass: 2-player board,Brass: Lancashire
Catalonia (fan expansion for Brass),Brass: Lancashire
Caverna: The Forgotten Folk,Caverna: The Cave Farmers
Caverna: The Forgotten Folk – Adventurers Promo,Caverna: The Cave Farmers
Caverna: The Forgotten Folk – Halflings promo,Caverna: The Cave Farmers
Caverna: Water Expansion,Caverna: The Cave Farmers
Caverna: Christmas Chamber,Caverna: The Cave Farmers
Caverna: LARP and Cosplay Postcard,Caverna: The Cave Farmers
Caverna: Mini Expansion,Caverna: The Cave Farmers
Mage Knight Board Game: Dual Color Cards Expansion,Mage Knight Board Game
Mage Knight Board Game: Shades of Tezla Expansion,Mage Knight Board Game
Mage Knight Board Game: Krang Character Expansion,Mage Knight Board Game
Mage Knight Board Game: The Lost Legion Expansion,Mage Knight Board Game
Agricola: Changelings,Agricola
Agricola: Glon­na­cker,Agricola
Agricola: France Deck,Agricola
Agricola: Bielefeld Deck,Agricola
Agricola: Belgium Deck,Agricola
Agricola: Brakelhühner Promo Card,Agricola
Agricola: De Lage Landen,Agricola
Agricola: Pi-Deck,Agricola
Agricola Ereigniskarten,Agricola
Agricola: NL-Deck,Agricola
Orléans: 5th Player Box,Orléans
Orléans: L'évêché de Tours,Orléans
Orléans: Promo Ortskarten N°2,Orléans
Orléans: Drawbridge,Orléans
Orléans: Neue Ortskarten N°5,Orléans
Orléans: Opera,Orléans
Orléans: Promo Ortskarten N°1,Orléans
Orléans: Neue Ortskarten N°4,Orléans
Orléans: Prairie,Orléans
Orléans: Trade & Intrigue,Orléans
Mansions of Madness: Second Edition – Horrific Journeys: Expansion,Mansions of Madness: Second Edition
Mansions of Madness: Second Edition – Sanctum of Twilight: Expansion,Mansions of Madness: Second Edition
Mansions of Madness: Second Edition – Beyond the Threshold: Expansion,Mansions of Madness: Second Edition
Mansions of Madness: Second Edition – Streets of Arkham: Expansion,Mansions of Madness: Second Edition
Mansions of Madness: Second Edition – Recurring Nightmares: Figure and Tile Collection,Mansions of Madness: Second Edition
Mansions of Madness: Second Edition – Suppressed Memories: Figure and Tile Collection,Mansions of Madness: Second Edition
A Feast for Odin: The Norwegians,A Feast for Odin
Deutscher Spielepreis 2017 Goodie Box,A Feast for Odin
"A Feast for Odin: Lofoten, Orkney, and Tierra del Fuego",A Feast for Odin
A Feast for Odin: New Special Tiles,A Feast for Odin
Food Chain Magnate: The Ketchup Mechanism & Other Ideas,Food Chain Magnate
Blood Rage: Hili – The Even-Handed,Blood Rage
Blood Rage: 5th Player Expansion,Blood Rage
Blood Rage: Gods of Ásgard,Blood Rage
Blood Rage: Kickstarter Exclusives,Blood Rage
Blood Rage: Mystics of Midgard,Blood Rage
Kingdom Death: Monster – Abyssal Woods Expansion,Kingdom Death: Monster
Kingdom Death: Monster – Ancient Root,Kingdom Death: Monster
Kingdom Death: Monster – Anonymous Survivor Promo,Kingdom Death: Monster
Kingdom Death: Monster – Black Knight Expansion,Kingdom Death: Monster
Kingdom Death: Monster – Campaigns of Death Expansion,Kingdom Death: Monster
Kingdom Death: Monster – Corsair Coat,Kingdom Death: Monster
Kingdom Death: Monster – Death Armor Expansion,Kingdom Death: Monster
Kingdom Death: Monster – False Messengers Promo,Kingdom Death: Monster
Kingdom Death: Monster – First Hero Expansion,Kingdom Death: Monster
Kingdom Death: Monster – Frogdog Expansion,Kingdom Death: Monster
Through the Ages: Spanish Promo Card Set,Through the Ages: A Story of Civilization
Cywilizacja: Poprzez wieki – Polski dodatek 2,Through the Ages: A Story of Civilization
BGO Extended 2.0 expansion (fan expansion for Through the Ages),Through the Ages: A Story of Civilization
Cywilizacja: Poprzez wieki – Polski dodatek 1,Through the Ages: A Story of Civilization
Through the Ages: A Story of Civilization – Czech expansion,Through the Ages: A Story of Civilization
Power Grid: Fabled Expansion,Power Grid
Brettspiel Adventskalender 2015,Power Grid
Power Grid: High-Voltage DC Transmission Passage C,Power Grid
Power Grid: The Stock Companies,Power Grid
Power Grid: Australia & Indian Subcontinent,Power Grid
Power Grid: Taxes,Power Grid
Power Grid: Northern Europe/United Kingdom & Ireland,Power Grid
Power Grid: Oracle & Industrial Espionage,Power Grid
Power Grid: Québec/Baden-Württemberg,Power Grid
Funkenschlag: Speicherkraftwerk,Power Grid
Star Wars: Imperial Assault – Coruscant Back Alleys Skirmish Map,Star Wars: Imperial Assault
Star Wars: Imperial Assault – Endor Defense Station Skirmish Map,Star Wars: Imperial Assault
Star Wars: Imperial Assault – Ezra Bridger and Kanan Jarrus Ally Pack,Star Wars: Imperial Assault
Star Wars: Imperial Assault – Hondo Ohnaka Villain Pack,Star Wars: Imperial Assault
Star Wars: Imperial Assault – Sabine Wren and Zeb Orrelios Ally Pack,Star Wars: Imperial Assault
Star Wars: Imperial Assault – Thrawn Villain Pack,Star Wars: Imperial Assault
Star Wars: Imperial Assault – Tyrants of Lothal,Star Wars: Imperial Assault
Star Wars: Imperial Assault – Ahsoka Tano Ally Pack,Star Wars: Imperial Assault
Star Wars: Imperial Assault – Alliance Rangers Ally Pack,Star Wars: Imperial Assault
Star Wars: Imperial Assault – BT-1 and 0-0-0 Villain Pack,Star Wars: Imperial Assault
Tzolk'in: The Mayan Calendar – Mini Expansion 2,Tzolk'in: The Mayan Calendar
Tzolk'in: The Mayan Calendar – Tribes & Prophecies,Tzolk'in: The Mayan Calendar
Tzolk'in: The Mayan Calendar – Mini Expansion 1,Tzolk'in: The Mayan Calendar
Azul: Special Factories Promo,Azul
Deutscher Spielepreis 2018 Goodie Box,Azul
Azul: Joker Tiles,Azul
Eclipse:  Anticipation of the Elders,Eclipse
Eclipse: Black Hole,Eclipse
Eclipse: Gift of the Elders,Eclipse
Eclipse: Shadow of the Rift,Eclipse
Eclipse: Nebula,Eclipse
Eclipse: The Galactic North,Eclipse
Eclipse: Minions of the Solstice,Eclipse
Eclipse: Ship Pack One,Eclipse
Eclipse: Pulsar,Eclipse
Eclipse: Rise of the Ancients,Eclipse
Le Havre: Le Grand Hameau – Tablet with App,Le Havre
Le Havre: Le Grand Hameau,Le Havre
Le Havre: Le Grand Hameau – Rattletrap car,Le Havre
Le Havre: Le Grand Hameau – Wholesale Bakery,Le Havre
Le Havre: Spielemesse Sonderkarte,Le Havre
Le Havre Expansion: Essen Promo Cards,Le Havre
Robinson Crusoe: Adventures on the Cursed Island – Mystery Tales,Robinson Crusoe: Adventures on the Cursed Island
Robinson Crusoe: Przygoda na przeklętej wyspie – Kafel Wulkanu,Robinson Crusoe: Adventures on the Cursed Island
Robinson Crusoe: Adventure in the Neverland Junior,Robinson Crusoe: Adventures on the Cursed Island
"Robinson Crusoe: Adventures on the Cursed Island – ""Time Travel"" Scenario",Robinson Crusoe: Adventures on the Cursed Island
Robinson Crusoe: Adventures on the Cursed Island – Hunting Adventures,Robinson Crusoe: Adventures on the Cursed Island
Robinson Crusoe: Adventures on the Cursed Island – In-Store Event Kit,Robinson Crusoe: Adventures on the Cursed Island
Robinson Crusoe: Adventures on the Cursed Island – Mystery Cards I,Robinson Crusoe: Adventures on the Cursed Island
Robinson Crusoe: Adventures on the Cursed Island – Shelter Upgrades,Robinson Crusoe: Adventures on the Cursed Island
Robinson Crusoe: Adventures on the Cursed Island – Event Cards,Robinson Crusoe: Adventures on the Cursed Island
Robinson Crusoe: Adventures on the Cursed Island – Herb Garden and Pen,Robinson Crusoe: Adventures on the Cursed Island
The Voyages of Marco Polo: The Secret Paths of Marco Polo,The Voyages of Marco Polo
The Voyages of Marco Polo: Agents of Venice,The Voyages of Marco Polo
The Voyages of Marco Polo: The New Characters,The Voyages of Marco Polo
Downfall (Fan expansion for Android: Netrunner),Android: Netrunner
Android: Netrunner – Council of the Crest,Android: Netrunner
Android: Netrunner – Down the White Nile,Android: Netrunner
Android: Netrunner – Kampala Ascendent,Android: Netrunner
Android: Netrunner – Magnum Opus cards,Android: Netrunner
Android: Netrunner – Reign and Reverie,Android: Netrunner
Android: Netrunner – The Devil and the Dragon,Android: Netrunner
Android: Netrunner – Whispers in Nalubaale,Android: Netrunner
Android: Netrunner – Blood and Water,Android: Netrunner
Android: Netrunner – Crimson Dust,Android: Netrunner
7 Wonders: Armada,7 Wonders
7 Wonders: Babel,7 Wonders
Collection (fan expansion for 7 Wonders),7 Wonders
7 Wonders: Wonder Pack,7 Wonders
Empires (fan expansion for 7 Wonders),7 Wonders
Game Wonders (fan expansion for 7 Wonders),7 Wonders
7 Wonders: Cities,7 Wonders
Lost Wonders (fan expansion for 7 Wonders),7 Wonders
More Wonders... (fan expansion for 7 Wonders),7 Wonders
Myths (fan expansion for 7 Wonders),7 Wonders
Brettspiel Adventskalender 2018,Keyflower
Keyflower: Boat 7,Keyflower
Keyflower: Delivery Man,Keyflower
Keyflower: Developer,Keyflower
Keyflower: Sorcerer,Keyflower
Keyflower: Keymelequin,Keyflower
Keyflower: Pig Shelter,Keyflower
Keyflower: Beekeeper,Keyflower
Keyflower: The Merchants,Keyflower
Keyflower: Trader,Keyflower
Anachrony: Fractures of Time,Anachrony
Anachrony: The Sentry Post,Anachrony
Anachrony: Doomsday Enhancement Pack,Anachrony
Anachrony: Exosuit Commander Pack,Anachrony
Race for the Galaxy: Retrofit Cards,Race for the Galaxy
Race for the Galaxy: New Worlds Promo,Race for the Galaxy
Race for the Galaxy: Xeno Invasion,Race for the Galaxy
Patronage (fan expansion to Race for the Galaxy),Race for the Galaxy
Race for the Galaxy: Alien Artifacts,Race for the Galaxy
Race for the Galaxy: The Brink of War,Race for the Galaxy
Race for the Galaxy: Rebel vs Imperium,Race for the Galaxy
Race for the Galaxy: The Gathering Storm,Race for the Galaxy
Caylus Expansion: The Jeweller,Caylus
Root: The Exiles and Partisans Deck,Root
Root: The Underworld Expansion,Root
Root: The Riverfolk Expansion,Root
Fields of Arle: New Travel Destination – Aachen,Fields of Arle
Fields of Arle: New Travel Destination – Bad Wörishofen,Fields of Arle
Fields of Arle: New Travel Destination – Baden,Fields of Arle
Fields of Arle: New Travel Destination – Baltrum,Fields of Arle
Fields of Arle: New Travel Destination – Kaiserslautern,Fields of Arle
Fields of Arle: New Travel Destination – Würzburg,Fields of Arle
Fields of Arle: New Travel Destination – Zürich,Fields of Arle
Fields of Arle: New Travel Destination – Ahrweiler,Fields of Arle
Fields of Arle: New Travel Destination – Arle,Fields of Arle
Fields of Arle: New Travel Destination – Basel,Fields of Arle
Lords of Waterdeep: Rapid Expansion Promo Card,Lords of Waterdeep
Lords of Waterdeep: Scoundrels of Skullport,Lords of Waterdeep
Lords of Waterdeep: Inevitable Betrayal Promo Card,Lords of Waterdeep
Rising Sun: Stronghold Pack,Rising Sun
Raging Sun (fan expansion to Rising Sun),Rising Sun
Rising Sun: Daimyo Box,Rising Sun
Rising Sun: Dynasty Invasion,Rising Sun
Rising Sun: Kami Unbound,Rising Sun
Rising Sun: Monster Pack,Rising Sun
Twilight Imperium (Third Edition): Shards of the Throne,Twilight Imperium (Third Edition)
Twilight Imperium (Third Edition): Shattered Empire,Twilight Imperium (Third Edition)
Five Tribes: Galbells,Five Tribes
Five Tribes: Whims of the Sultan,Five Tribes
Five Tribes: The Thieves of Naqala,Five Tribes
Five Tribes: The Artisans of Naqala,Five Tribes
Five Tribes: Wilwit,Five Tribes
Five Tribes: Dhenim,Five Tribes
Eldritch Horror: Masks of Nyarlathotep,Eldritch Horror
Eldritch Horror: Cities in Ruin,Eldritch Horror
Eldritch Horror: The Dreamlands,Eldritch Horror
Eldritch Horror: Signs of Carcosa,Eldritch Horror
Eldritch Horror: Strange Remnants,Eldritch Horror
Eldritch Horror: Under the Pyramids,Eldritch Horror
Eldritch Horror: Forsaken Lore,Eldritch Horror
Eldritch Horror: Mountains of Madness,Eldritch Horror
The El Grande Expansions,El Grande
El Grande: Grandissimo,El Grande
El Grande: König & Intrigant – Player's Edition,El Grande
El Grande: Grossinquisitor und Kolonien,El Grande
El Grande: König & Intrigant,El Grande
El Grande: König & Intrigant – Unverkäufliche Sonderkarten,El Grande
Brettspiel Adventskalender 2018,Codenames
Codenames: Bonuskaarten 2018,Codenames
Codenames: Cartes promo – Univers Geek,Codenames
Tajniacy: Obcy Agenci,Codenames
Codenames: Bonus Pack – Board Gaming (English),Codenames
Fedőnevek: Magyar bónusz csomag,Codenames
Tajniacy: Nowi Agenci,Codenames
Tajniacy: Sami Nieswoi,Codenames
Codenames: Authors & Games,Codenames
Codenames: Bonus Pack – Board Gaming (German),Codenames
Clank! Legacy: Acquisitions Incorporated – Upper Management Pack,Clank!: A Deck-Building Adventure
Clank! Expeditions: Gold and Silk,Clank!: A Deck-Building Adventure
Clank!: Expedition Leader,Clank!: A Deck-Building Adventure
Clank!: The Mummy's Curse,Clank!: A Deck-Building Adventure
Clank!: Wand of Time,Clank!: A Deck-Building Adventure
Brettspiel Adventskalender 2017,Clank!: A Deck-Building Adventure
Clank!: Brawn vs. Boots,Clank!: A Deck-Building Adventure
Clank!: Enchanted Dice,Clank!: A Deck-Building Adventure
Clank!: Friendly Watcher,Clank!: A Deck-Building Adventure
Clank!: Magic Spectacles,Clank!: A Deck-Building Adventure
Dominion: Renaissance,Dominion: Intrigue
Dominion: Dismantle Promo Card,Dominion: Intrigue
Dominion: Erweiterung – Basisspiel & Die Intrige,Dominion: Intrigue
Dominion: Nocturne,Dominion: Intrigue
Pirate's Life (Fan Expansion to Dominion),Dominion: Intrigue
Dominion: Empires,Dominion: Intrigue
Dominion: Höflinge Promo Card,Dominion: Intrigue
Dominion: Intrigue Update Pack,Dominion: Intrigue
Dominion: Sauna / Avanto Promo Card,Dominion: Intrigue
Dominion: Adventures,Dominion: Intrigue
The Gallerist: Scoring Expansion,The Gallerist
The Gallerist: KS Stretch Goal Pack #2,The Gallerist
Patchwork: Automa,Patchwork
Patchwork: 5x5 Bonuskarte,Patchwork
Special Buttons (fan-expansion for Patchwork),Patchwork
Deutscher Spielepreis 2016 Goodie Box,Mombasa
Mombasa: Cooked Books Mini Expansion,Mombasa
Mombasa: E1/E2 Company Track,Mombasa
Battlestar Galactica: The Board Game – Daybreak Expansion,Battlestar Galactica: The Board Game
Battlestar Galactica: The Board Game – Exodus Expansion,Battlestar Galactica: The Board Game
Battlestar Galactica: The Board Game – Pegasus Expansion,Battlestar Galactica: The Board Game
Battlestar Galactica: Official Variant Rules,Battlestar Galactica: The Board Game
Roll for the Galaxy: Rivalry,Roll for the Galaxy
Roll for the Galaxy: Bountiful Gaming Grid Promo Tile,Roll for the Galaxy
Roll for the Galaxy: Terraforming Colony/Diversified Economy Promo Tile,Roll for the Galaxy
Roll for the Galaxy: Ambition,Roll for the Galaxy
Sherlock Holmes Consulting Detective: Murder Behind Closed Doors,Sherlock Holmes Consulting Detective: The Thames Murders & Other Cases
Sherlock Holmes Détective Conseil: L'Homme Sans Visage,Sherlock Holmes Consulting Detective: The Thames Murders & Other Cases
Sherlock Holmes Détective Conseil: Les Masques Africains,Sherlock Holmes Consulting Detective: The Thames Murders & Other Cases
L'affaire Diavolo (Fan expansion for Sherlock Holmes Détective Conseil),Sherlock Holmes Consulting Detective: The Thames Murders & Other Cases
Sherlock Holmes Consulente Investigativo: Il Mistero dell'Impiccato,Sherlock Holmes Consulting Detective: The Thames Murders & Other Cases
Sherlock Holmes Détective Conseil: La Piste Tordue,Sherlock Holmes Consulting Detective: The Thames Murders & Other Cases
Sherlock Holmes Détective Conseil: La rançon du diable,Sherlock Holmes Consulting Detective: The Thames Murders & Other Cases
Sherlock Holmes Détective Conseil: Octobre 1891,Sherlock Holmes Consulting Detective: The Thames Murders & Other Cases
Sherlock Holmes Détective Conseil: Oliver Stone,Sherlock Holmes Consulting Detective: The Thames Murders & Other Cases
Sherlock Holmes Consulting Detective: Adventures by Gaslight,Sherlock Holmes Consulting Detective: The Thames Murders & Other Cases
Troyes: The Ladies of Troyes,Troyes
Troyes: Bonus Cards,Troyes
Antic (fan expansion for T.I.M.E Stories),T.I.M.E Stories
T.I.M.E Stories: Madame,T.I.M.E Stories
T.I.M.E. Stories Revolution: The Hadal Project,T.I.M.E Stories
La Cavale des Daltons (fan expansion for T.I.M.E Stories),T.I.M.E Stories
City of Souls (fan expansion for T.I.M.E Stories),T.I.M.E Stories
Dilemma (fan expansion for T.I.M.E Stories),T.I.M.E Stories
Dreamland (fan expansion for T.I.M.E Stories),T.I.M.E Stories
Geologists (fan expansion for T.I.M.E Stories),T.I.M.E Stories
Hora fugit facta manent (fan expansion for T.I.M.E. Stories),T.I.M.E Stories
La manufacture Lilienfeld (fan expansion for T.I.M.E Stories),T.I.M.E Stories
Russian Railroads: Juri Dreigleisky,Russian Railroads
Russian Railroads: American Railroads,Russian Railroads
Russian Railroads: German Railroads,Russian Railroads
Russian Railroads: Mini-Expansion,Russian Railroads
Euphrat & Tigris: Die Zikkurat,Tigris & Euphrates
Star Wars: X-Wing Miniatures Game – Saw's Renegades Expansion Pack,Star Wars: X-Wing Miniatures Game
Star Wars: X-Wing Miniatures Game – TIE Reaper Expansion Pack,Star Wars: X-Wing Miniatures Game
Star Wars: X-Wing Miniatures Game – Alpha-Class Star Wing Expansion Pack,Star Wars: X-Wing Miniatures Game
Star Wars: X-Wing Miniatures Game – Auzituck Gunship Expansion Pack,Star Wars: X-Wing Miniatures Game
Star Wars: X-Wing Miniatures Game – C-ROC Cruiser Expansion Pack,Star Wars: X-Wing Miniatures Game
Star Wars: X-Wing Miniatures Game – Guns for Hire Expansion Pack,Star Wars: X-Wing Miniatures Game
Star Wars: X-Wing Miniatures Game – M12-L Kimogila Fighter Expansion Pack,Star Wars: X-Wing Miniatures Game
Star Wars: X-Wing Miniatures Game – Phantom II Expansion Pack,Star Wars: X-Wing Miniatures Game
Star Wars: X-Wing Miniatures Game – Resistance Bomber Expansion Pack,Star Wars: X-Wing Miniatures Game
Star Wars: X-Wing Miniatures Game – Scurrg H-6 Bomber Expansion Pack,Star Wars: X-Wing Miniatures Game
Pandemic: Gen Con 2016 Promos – Z-Force Team Member/Game Convention,Pandemic
Pandemic: Survival Promos – Crisis Mitigator/Relocation Specialist,Pandemic
Pandemic: Promo Roles,Pandemic
Pandemic: State of Emergency,Pandemic
Pandemic: In the Lab,Pandemic
Pandemic: On the Brink,Pandemic
"Pandemie: Uitbreiding ""De Generalist""",Pandemic
Dominion: Renaissance,Dominion
Dominion: Dismantle Promo Card,Dominion
Dominion: Erweiterung – Basisspiel & Die Intrige,Dominion
Dominion: Nocturne,Dominion
Pirate's Life (Fan Expansion to Dominion),Dominion
Animals expansion (mini fan expansion for Dominion),Dominion
Dominion: Empires,Dominion
Dominion: Höflinge Promo Card,Dominion
Dominion: Intrigue (Second Edition),Dominion
Dominion: Intrigue Update Pack,Dominion
Dead of Winter: Giggles,Dead of Winter: A Crossroads Game
Dead of Winter: A Crossroads Game – BGG Crossroads Promo,Dead of Winter: A Crossroads Game
Dead of Winter: KD James,Dead of Winter: A Crossroads Game
Dead of Winter: Meryl Wolfe,Dead of Winter: A Crossroads Game
Dead of Winter: Ruckus Burley,Dead of Winter: A Crossroads Game
Dead of Winter: Warring Colonies,Dead of Winter: A Crossroads Game
Dead of Winter: Rich Sommer,Dead of Winter: A Crossroads Game
Dead of Winter: Rodney Smith,Dead of Winter: A Crossroads Game
Dead of Winter: Andrea Smith,Dead of Winter: A Crossroads Game
Dead of Winter: Dice Tower Crossroads Promo,Dead of Winter: A Crossroads Game
Kemet: Seth,Kemet
Kemet: Dice Tower Promo 2016,Kemet
