Dodatek,Osnova
Kemet: New Power Tiles,Kemet
Kemet: Skills and Black Power Tile For Ta-Seti,Kemet
Kemet: Ta-Seti,Kemet
C3K: Creatures Crossover Cyclades/Kemet,Kemet
Agricola: Corbarius Deck,Agricola (Revised Edition)
Agricola: Bubulcus Deck,Agricola (Revised Edition)
Agricola: Changelings,Agricola (Revised Edition)
Agricola: Farmers of the Moor,Agricola (Revised Edition)
Agricola Game Expansion: Blue,Agricola (Revised Edition)
Agricola Game Expansion: Green,Agricola (Revised Edition)
Agricola Game Expansion: Purple,Agricola (Revised Edition)
Agricola Game Expansion: Red,Agricola (Revised Edition)
Agricola Game Expansion: White,Agricola (Revised Edition)
Agricola Game Expansion: Yellow,Agricola (Revised Edition)
Descent: Journeys in the Dark (Second Edition) – Lost Legends Expansion Pack,Descent: Journeys in the Dark (Second Edition)
Descent: Journeys in the Dark (Second Edition) – Road to Legend,Descent: Journeys in the Dark (Second Edition)
Descent: Journeys in the Dark (Second Edition) – Shards of Everdark,Descent: Journeys in the Dark (Second Edition)
Descent: Journeys in the Dark (Second Edition) – Stewards of the Secret,Descent: Journeys in the Dark (Second Edition)
Descent: Journeys in the Dark (Second Edition) – The Chains That Rust,Descent: Journeys in the Dark (Second Edition)
Descent: Journeys in the Dark (Second Edition) – Ardus Ix'Erebus Lieutenant Pack,Descent: Journeys in the Dark (Second Edition)
Descent: Journeys in the Dark (Second Edition) – Bonds of the Wild,Descent: Journeys in the Dark (Second Edition)
Descent: Journeys in the Dark (Second Edition) – Dark Elements,Descent: Journeys in the Dark (Second Edition)
Descent: Journeys in the Dark (Second Edition) – Heirs of Blood,Descent: Journeys in the Dark (Second Edition)
Descent: Journeys in the Dark (Second Edition) – Kyndrithul Lieutenant Pack,Descent: Journeys in the Dark (Second Edition)
Garphill Games 5-Year Anniversary Promo Pack,Raiders of the North Sea
Raiders of the North Sea: Garphill Games 5-Year Anniversary Promos,Raiders of the North Sea
Raiders of the North Sea: Ceedee Promo Card,Raiders of the North Sea
Raiders of the North Sea: Fields of Fame,Raiders of the North Sea
Raiders of the North Sea: Hall of Heroes,Raiders of the North Sea
Raiders of the North Sea: Jarl Promo,Raiders of the North Sea
Raiders of the North Sea: Outsiders,Raiders of the North Sea
Raiders of the North Sea: Solo Variant,Raiders of the North Sea
Raiders of the North Sea: The Meeple Men Promo Card,Raiders of the North Sea
Raiders of the North Sea: The Mico Promo,Raiders of the North Sea
Stone Age: The Mammoth Herd,Stone Age
Stadt Land Spielt Limitierte Sonderdrucke 2013,Stone Age
Stone Age: Casino,Stone Age
Schmuck und Handel (fan expansion for Stone Age),Stone Age
Stone Age: The Expansion,Stone Age
Stone Age: The New Huts,Stone Age
Alchemists: The King's Golem,Alchemists
Alchemists: Publisher,Alchemists
Alchemists: Ring of Favor,Alchemists
Yokohama: Achievements & Free Agents Promo,Yokohama
Aeon's End: Buried Secrets,Aeon's End
Aeon's End: Echo Stone and Splinter Missile Promo,Aeon's End
Aeon's End: The Ancients,Aeon's End
Aeon's End: Thieving Spirit,Aeon's End
Aeon's End: Tabletop Day 2017 Promos – Drown in Flames / Glyph Enigma,Aeon's End
Aeon's End: The Nameless,Aeon's End
Aeon's End: The Outer Dark,Aeon's End
Aeon's End: The Void,Aeon's End
Aeon's End: War Eternal – Promo Pack,Aeon's End
Aeon's End: Fleeting Vision Promo,Aeon's End
Star Realms: Command Deck – Lost Fleet,Star Realms
Star Realms: Command Deck – The Alignment,Star Realms
Star Realms: Command Deck – The Alliance,Star Realms
Star Realms: Command Deck – The Coalition,Star Realms
Star Realms: Command Deck – The Pact,Star Realms
Star Realms: Command Deck – The Union,Star Realms
Star Realms: Command Deck – The Unity,Star Realms
Star Realms: Frontiers – Kickstarter Promos,Star Realms
Star Realms: Merc Destroyer Promo Card,Star Realms
Star Realms: Merc Tower Promo Card,Star Realms
War of the Ring: Scenario – The Breaking of the Fellowship,War of the Ring (First Edition)
War of the Ring: Battles of the Third Age,War of the Ring (First Edition)
Legendary Encounters: An Alien Deck Building Game Expansion,Legendary Encounters: An Alien Deck Building Game
Legendary Encounters: ALIEN Conversion Kit,Legendary Encounters: An Alien Deck Building Game
Champions of Midgard: Asian Monsters,Champions of Midgard
Champions of Midgard: Bjorn Hammerblow the Fantastic promo,Champions of Midgard
Champions of Midgard: Gullinkambi Public Boat Promo,Champions of Midgard
Champions of Midgard: Meeple Monster Promo Card,Champions of Midgard
Champions of Midgard: Mercenaries Land Journey Promo Card,Champions of Midgard
Champions of Midgard: Merchant Ship Promo Cards,Champions of Midgard
Champions of Midgard: Shipwreck Journey Promo Cards,Champions of Midgard
Champions of Midgard: Draudan and Bergrisar King Promo Cards,Champions of Midgard
Champions of Midgard: Jarl Edition,Champions of Midgard
Champions of Midgard: The Dark Mountains,Champions of Midgard
Castles of Mad King Ludwig: Secrets,Castles of Mad King Ludwig
Zamki szalonego króla Ludwika: Polskie zamki,Castles of Mad King Ludwig
Camel Up: The Referee Camel & Istanbul – Caravan Leader Mini Expansion,Istanbul
Brettspiel Adventskalender 2016,Istanbul
Istanbul: Caravan Leader Mini Expansion,Istanbul
Istanbul: Letters & Seals,Istanbul
Istanbul: Pegasus Depot Mini Expansion,Istanbul
Istanbul: Mocha & Baksheesh,Istanbul
Istanbul: Kebab Shop Mini Expansion,Istanbul
A Game of Thrones: The Board Game (Second Edition) – Mother of Dragons,A Game of Thrones: The Board Game (Second Edition)
A Game of Thrones: The Board Game (Second Edition) – A Feast for Crows,A Game of Thrones: The Board Game (Second Edition)
A Game of Thrones: The Board Game (Second Edition) – A Dance with Dragons,A Game of Thrones: The Board Game (Second Edition)
Architects of the West Kingdom: Garphill Games 5-Year Anniversary Promos,Architects of the West Kingdom
Architects of the West Kingdom: Paladins Apprentices,Architects of the West Kingdom
Garphill Games 5-Year Anniversary Promo Pack,Architects of the West Kingdom
Architects of the West Kingdom: Extra Apprentices,Architects of the West Kingdom
Architects of the West Kingdom: Extra Buildings,Architects of the West Kingdom
Architects of the West Kingdom: Extra Player Boards,Architects of the West Kingdom
The Resistance: Avalon Promos,The Resistance: Avalon
Santorini: Asteria,Santorini
Santorini: Hippolyta,Santorini
Santorini: Hydra,Santorini
Santorini: Iris,Santorini
Santorini: Nyx,Santorini
Santorini: Pegasus,Santorini
Santorini: Promo Pack,Santorini
Santorini: Castor & Pollux,Santorini
Santorini: Eris,Santorini
Santorini: Golden Fleece,Santorini
Teotihuacan: City of Gods – Man vs Meeple Promo,Teotihuacan: City of Gods
"Teotihuacan: City of Gods – Pyramid Tile Promo, Red Temple",Teotihuacan: City of Gods
Teotihuacan: Late Preclassic Period,Teotihuacan: City of Gods
Brettspiel Adventskalender 2018,Teotihuacan: City of Gods
Teotihuacan: City of Gods – Brettspiel Adventskalender 2018 Promo,Teotihuacan: City of Gods
Teotihuacan: City of Gods – Dice Settlers Promo,Teotihuacan: City of Gods
